{
  "schema_version": 1,
  "snapshot_id": "20260720T060000Z_44d2cd5f_64ea971e",
  "sections": [
    {
      "id": "warnings",
      "title": "Official warning active",
      "register_plain": "The national weather service has an active marine warning covering part of your route. Official forecasts are the authority — read the bulletin before anything else.",
      "register_pro": "Authority override: bulletin casquets:BMS-large:2026-07-20T12:00:00Z active during the passage window. This state overrides the personal-limit summary and does not assert a numeric limit exceedance.",
      "evidence_ids": [
        "E23"
      ]
    },
    {
      "id": "synoptic_story",
      "title": "The weather system driving this",
      "register_plain": "A strengthening low-pressure system sits west of the approaches, at your latitude — that is what sets the wind pattern over your route. The chart panels show how it moves over the next days.",
      "register_pro": "Detected systems (reference-demo-20260719T18Z): lows L1 (1002 hPa near 49°N 7°W), deepening 18 hPa/24h, moving ENE 31 kt; highs none. Front-type labels withheld pending corroboration (§4.1).",
      "evidence_ids": [],
      "glossary_terms": [
        "model run"
      ],
      "availability": {
        "status": "available"
      }
    },
    {
      "id": "route_impact",
      "title": "Route impact, leg by leg",
      "register_plain": "What the forecast means for each stretch of your passage:",
      "register_pro": "Per-leg conditions evaluated hourly across each leg's ETA occupancy window (slow/nominal/fast scenarios), course-relative.",
      "evidence_ids": [],
      "per_leg": [
        {
          "leg_id": "L1",
          "register_plain": "Cherbourg, Passe de l'Ouest → Off Omonville-la-Rogue: fresh winds while you are on this stretch (Mon 20 Jul 06:00–Mon 20 Jul 07:45 UTC).",
          "register_pro": "L1 Cherbourg, Passe de l'Ouest → Off Omonville-la-Rogue (7.91 nm, 294.8°T): sustained 17 kt, gusts to 22 kt across the ETA window Mon 20 Jul 06:00–Mon 20 Jul 07:45 UTC. Seas to 1.0 m significant (deterministic wave model — no wave ensembles exist).",
          "evidence_ids": [
            "E1"
          ]
        },
        {
          "leg_id": "L2",
          "register_plain": "Off Omonville-la-Rogue → NW of Cap de la Hague: fresh winds while you are on this stretch (Mon 20 Jul 07:13–Mon 20 Jul 09:48 UTC).",
          "register_pro": "L2 Off Omonville-la-Rogue → NW of Cap de la Hague (9.26 nm, 293°T): sustained 17 kt, gusts to 22 kt across the ETA window Mon 20 Jul 07:13–Mon 20 Jul 09:48 UTC. Seas to 1.0 m significant (deterministic wave model — no wave ensembles exist).",
          "evidence_ids": [
            "E2"
          ]
        },
        {
          "leg_id": "L3",
          "register_plain": "NW of Cap de la Hague → Casquets TSS crossing: fresh winds while you are on this stretch (Mon 20 Jul 08:38–Mon 20 Jul 17:03 UTC). 24 of 51 forecast scenarios exceed your 18 kt wind limit around Mon 20 Jul 18:00 UTC.",
          "register_pro": "L3 NW of Cap de la Hague → Casquets TSS crossing (32.6 nm, 288.6°T): sustained 17–18 kt, gusts to 24 kt across the ETA window Mon 20 Jul 08:38–Mon 20 Jul 17:03 UTC. Seas to 1.3 m significant (deterministic wave model — no wave ensembles exist). Ensemble (scenario ensemble): 24 of 51 forecast scenarios exceed your 18 kt wind limit at 2026-07-20T18:00:00Z (raw scenario fraction — not a calibrated probability).",
          "evidence_ids": [
            "E3",
            "E4",
            "E5"
          ]
        },
        {
          "leg_id": "L4",
          "register_plain": "Casquets TSS crossing → Mid-Channel: strong winds while you are on this stretch (Mon 20 Jul 13:39–Mon 20 Jul 22:34 UTC). All 51 forecast scenarios exceed your 18 kt wind limit around Mon 20 Jul 23:00 UTC.",
          "register_pro": "L4 Casquets TSS crossing → Mid-Channel (24.83 nm, 291.5°T): sustained 17–22 kt, gusts to 30 kt across the ETA window Mon 20 Jul 13:39–Mon 20 Jul 22:34 UTC. Seas to 1.8 m significant (deterministic wave model — no wave ensembles exist). Ensemble (scenario ensemble): all 51 forecast scenarios exceed your 18 kt wind limit at 2026-07-20T23:00:00Z (raw scenario fraction — not a calibrated probability).",
          "evidence_ids": [
            "E6",
            "E7",
            "E8",
            "E9"
          ]
        },
        {
          "leg_id": "L5",
          "register_plain": "Mid-Channel → Plymouth approach (E of Eddystone): near-gale winds while you are on this stretch (Mon 20 Jul 17:28–Tue 21 Jul 04:04 UTC). All 51 forecast scenarios exceed your 28 kt gust limit around Tue 21 Jul 02:00 UTC.",
          "register_pro": "L5 Mid-Channel → Plymouth approach (E of Eddystone) (24.77 nm, 291.6°T): sustained 18–28 kt, gusts to 38 kt across the ETA window Mon 20 Jul 17:28–Tue 21 Jul 04:04 UTC. Seas to 2.6 m significant (deterministic wave model — no wave ensembles exist). Ensemble (scenario ensemble): all 51 forecast scenarios exceed your 28 kt gust limit at 2026-07-21T02:00:00Z (raw scenario fraction — not a calibrated probability).",
          "evidence_ids": [
            "E10",
            "E11",
            "E12",
            "E13",
            "E14",
            "E15"
          ]
        },
        {
          "leg_id": "L6",
          "register_plain": "Plymouth approach (E of Eddystone) → Plymouth breakwater, western entrance: near-gale winds while you are on this stretch (Mon 20 Jul 21:17–Tue 21 Jul 05:37 UTC). All 51 forecast scenarios exceed your 28 kt gust limit around Tue 21 Jul 02:00 UTC.",
          "register_pro": "L6 Plymouth approach (E of Eddystone) → Plymouth breakwater, western entrance (6.92 nm, 316.2°T): sustained 20–29 kt, gusts to 39 kt across the ETA window Mon 20 Jul 21:17–Tue 21 Jul 05:37 UTC. Seas to 2.8 m significant (deterministic wave model — no wave ensembles exist). Ensemble (scenario ensemble): all 51 forecast scenarios exceed your 28 kt gust limit at 2026-07-21T02:00:00Z (raw scenario fraction — not a calibrated probability).",
          "evidence_ids": [
            "E16",
            "E17",
            "E18",
            "E19",
            "E20",
            "E21",
            "E22"
          ]
        }
      ],
      "glossary_terms": [
        "gust",
        "ensemble",
        "ETA window"
      ]
    },
    {
      "id": "decision",
      "title": "Against your declared limits",
      "register_plain": "An official marine warning covers part of your route. That takes precedence over everything below. The main signal: all 51 forecast scenarios exceed your 18 kt limit on Casquets TSS crossing → Mid-Channel around Mon 20 Jul 23:00 UTC.",
      "register_pro": "Authority override active: an official bulletin covers route zones during the passage window. Driver: W-SUST-03 on L4 at 2026-07-20T23:00:00Z — 51/51 members > 18 kt.",
      "evidence_ids": [
        "E9"
      ]
    },
    {
      "id": "what_could_change",
      "title": "What could change",
      "register_plain": "Forecasts update several times a day. Check again after the next model run (expected around Sun 19 Jul 22:30 UTC) — especially if you are close to your limits.",
      "register_pro": "Next gfs_0p25 cycle expected ~2026-07-19T22:30:00Z. Model run ids in this analysis are inferred from publication schedules until the prepared-run pipeline provides authoritative cycles. Agreement between runs is not proof of accuracy.",
      "evidence_ids": [],
      "glossary_terms": [
        "model run"
      ]
    },
    {
      "id": "unsupported",
      "title": "Not assessed by this analysis",
      "register_plain": "This briefing does NOT cover: tidal currents (no prepared current grid), tidal gates & HW/LW heights (no tide data), tropical systems, ice. Partly assessed: waves, visibility and convection. No warning here does not mean no risk.",
      "register_pro": "Unassessed hazard classes: tidal currents (no prepared current grid); tidal gates & HW/LW heights (no tide data); tropical systems; ice. Partial capability coverage: waves (deterministic wave model only; no wave ensemble); visibility_and_convection (screening signals only (single model, GFS); official warnings remain authoritative). Absence of a flag must not be read as absence of risk (brief §5).",
      "evidence_ids": []
    },
    {
      "id": "emulated_disclosure",
      "title": "Emulated data in this analysis",
      "register_plain": "Some values in this briefing come from EMULATED (synthetic) data sources, marked with a badge. Do not use them for a real passage decision.",
      "register_pro": "Emulated evidence entries: E23. Provider modes are recorded in the snapshot inputs.",
      "evidence_ids": [
        "E23"
      ]
    }
  ],
  "next_runs": [
    {
      "model": "gfs_0p25",
      "expected_at": "2026-07-19T22:30:00Z"
    }
  ],
  "next_run": {
    "model": "gfs_0p25",
    "expected_at": "2026-07-19T22:30:00Z"
  }
}