{
  "schema_version": 1,
  "snapshot_id": "snapshot_v2_24c2d8022da4ff3c",
  "sections": [
    {
      "id": "synoptic_story",
      "title": "The weather system driving this",
      "register_plain": "This run has no causal attribution. Reason: no prepared synoptic run was supplied.",
      "register_pro": "Synoptic availability: unavailable (no prepared synoptic run was supplied). Route conditions and limit checks remain available, but this run does not attribute them to a weather system.",
      "evidence_ids": [],
      "glossary_terms": [
        "model run"
      ],
      "availability": {
        "status": "unavailable",
        "reason": "no prepared synoptic run was supplied"
      }
    },
    {
      "id": "route_impact",
      "title": "Route impact, leg by leg",
      "register_plain": "What the forecast means for each stretch of your passage:",
      "register_pro": "Per-leg conditions evaluated hourly across each leg's ETA occupancy window (slow/nominal/fast scenarios), course-relative.",
      "evidence_ids": [],
      "per_leg": [
        {
          "leg_id": "L1",
          "register_plain": "Cherbourg, Passe de l'Ouest → Off Omonville-la-Rogue: moderate winds while you are on this stretch (Sun 12 Jul 06:00–Sun 12 Jul 07:45 UTC).",
          "register_pro": "L1 Cherbourg, Passe de l'Ouest → Off Omonville-la-Rogue (7.91 nm, 294.8°T): sustained 14–15 kt, gusts to 25 kt across the ETA window Sun 12 Jul 06:00–Sun 12 Jul 07:45 UTC. Seas to 0.8 m significant (deterministic wave model; no wave ensembles exist).",
          "evidence_ids": [
            "E1",
            "E2"
          ]
        },
        {
          "leg_id": "L2",
          "register_plain": "Off Omonville-la-Rogue → NW of Cap de la Hague: fresh winds while you are on this stretch (Sun 12 Jul 07:13–Sun 12 Jul 09:48 UTC).",
          "register_pro": "L2 Off Omonville-la-Rogue → NW of Cap de la Hague (9.26 nm, 293°T): sustained 19–20 kt, gusts to 25 kt across the ETA window Sun 12 Jul 07:13–Sun 12 Jul 09:48 UTC. Seas to 1.3 m significant (deterministic wave model; no wave ensembles exist).",
          "evidence_ids": [
            "E3",
            "E4",
            "E5"
          ]
        },
        {
          "leg_id": "L3",
          "register_plain": "NW of Cap de la Hague → Casquets TSS crossing: strong winds while you are on this stretch (Sun 12 Jul 08:38–Sun 12 Jul 17:03 UTC). All 51 forecast scenarios exceed your 28 kt gust limit around Sun 12 Jul 16:00 UTC.",
          "register_pro": "L3 NW of Cap de la Hague → Casquets TSS crossing (32.6 nm, 288.6°T): sustained 20–25 kt, gusts to 32 kt across the ETA window Sun 12 Jul 08:38–Sun 12 Jul 17:03 UTC. Seas to 1.9 m significant (deterministic wave model; no wave ensembles exist). Ensemble (scenario ensemble): all 51 forecast scenarios exceed your 28 kt gust limit at 2026-07-12T16:00:00Z (raw scenario fraction; not a calibrated probability).",
          "evidence_ids": [
            "E6",
            "E7",
            "E8",
            "E9",
            "E10",
            "E11"
          ]
        },
        {
          "leg_id": "L4",
          "register_plain": "Casquets TSS crossing → Mid-Channel: strong winds while you are on this stretch (Sun 12 Jul 13:39–Sun 12 Jul 22:34 UTC). All 51 forecast scenarios exceed your 28 kt gust limit around Sun 12 Jul 19:00 UTC.",
          "register_pro": "L4 Casquets TSS crossing → Mid-Channel (24.83 nm, 291.5°T): sustained 19–27 kt, gusts to 35 kt across the ETA window Sun 12 Jul 13:39–Sun 12 Jul 22:34 UTC. Seas to 2.3 m significant (deterministic wave model; no wave ensembles exist). Models diverge on 1 h of this leg (max spread 7.7 kt); agreement is not proof, divergence says wait for the next run. Ensemble (scenario ensemble): all 51 forecast scenarios exceed your 28 kt gust limit at 2026-07-12T19:00:00Z (raw scenario fraction; not a calibrated probability).",
          "evidence_ids": [
            "E12",
            "E13",
            "E14",
            "E15",
            "E16",
            "E17",
            "E18"
          ]
        },
        {
          "leg_id": "L5",
          "register_plain": "Mid-Channel → Plymouth approach (E of Eddystone): fresh winds while you are on this stretch (Sun 12 Jul 17:28–Mon 13 Jul 04:04 UTC). All 51 forecast scenarios exceed your 28 kt gust limit around Sun 12 Jul 17:00 UTC.",
          "register_pro": "L5 Mid-Channel → Plymouth approach (E of Eddystone) (24.77 nm, 291.6°T): sustained 17–20 kt, gusts to 34 kt across the ETA window Sun 12 Jul 17:28–Mon 13 Jul 04:04 UTC. Seas to 2.0 m significant (deterministic wave model; no wave ensembles exist). Ensemble (scenario ensemble): all 51 forecast scenarios exceed your 28 kt gust limit at 2026-07-12T17:00:00Z (raw scenario fraction; not a calibrated probability).",
          "evidence_ids": [
            "E19",
            "E20",
            "E21",
            "E22",
            "E23"
          ]
        },
        {
          "leg_id": "L6",
          "register_plain": "Plymouth approach (E of Eddystone) → Plymouth breakwater, western entrance: moderate winds while you are on this stretch (Sun 12 Jul 21:17–Mon 13 Jul 05:37 UTC). 28 of 51 forecast scenarios exceed your 28 kt gust limit around Mon 13 Jul 05:00 UTC.",
          "register_pro": "L6 Plymouth approach (E of Eddystone) → Plymouth breakwater, western entrance (6.92 nm, 316.2°T): sustained 12–15 kt, gusts to 27 kt across the ETA window Sun 12 Jul 21:17–Mon 13 Jul 05:37 UTC. Seas to 1.5 m significant (deterministic wave model; no wave ensembles exist). Models diverge on 10 h of this leg (max spread 11.6 kt); agreement is not proof, divergence says wait for the next run. Ensemble (scenario ensemble): 28 of 51 forecast scenarios exceed your 28 kt gust limit at 2026-07-13T05:00:00Z (raw scenario fraction; not a calibrated probability).",
          "evidence_ids": [
            "E24",
            "E25",
            "E26",
            "E27"
          ]
        }
      ],
      "glossary_terms": [
        "gust",
        "ensemble",
        "ETA window"
      ]
    },
    {
      "id": "decision",
      "title": "Against your declared limits",
      "register_plain": "The forecasts disagree too much to assess this passage against your limits. Reassess after the next model run. The main signal: all 51 forecast scenarios exceed your 28 kt limit on NW of Cap de la Hague → Casquets TSS crossing around Sun 12 Jul 16:00 UTC.",
      "register_pro": "Deterministic model divergence exceeds assessment tolerance within the passage window. Driver: W-GUST-03 on L3 at 2026-07-12T16:00:00Z; 51/51 members > 28 kt.",
      "evidence_ids": [
        "E8"
      ]
    },
    {
      "id": "what_could_change",
      "title": "What could change",
      "register_plain": "Next forecast update time unavailable. Check the published forecast before departure.",
      "register_pro": "No future publication estimate is available from the loaded forecast metadata and known tile-pipeline schedules. Synthetic runs have no scheduled update.",
      "evidence_ids": [],
      "glossary_terms": [
        "model run"
      ]
    },
    {
      "id": "unsupported",
      "title": "Not assessed by this analysis",
      "register_plain": "This briefing does NOT cover: tidal currents (no prepared current grid), tidal gates & HW/LW heights (no tide data), official marine warnings (no feed configured), causal synoptic attribution (no prepared synoptic run), tropical systems, ice. Partly assessed: waves, visibility and convection. No warning here does not mean no risk.",
      "register_pro": "Unassessed hazard classes: tidal currents (no prepared current grid); tidal gates & HW/LW heights (no tide data); official marine warnings (no feed configured); causal synoptic attribution (no prepared synoptic run); tropical systems; ice. Partial capability coverage: waves (deterministic wave model only; no wave ensemble); visibility_and_convection (screening signals only (single model, GFS); official warnings remain authoritative). Absence of a flag must not be read as absence of risk (brief §5).",
      "evidence_ids": []
    }
  ],
  "next_runs": []
}